<?xml version="1.0" encoding="UTF-8"?>
<tns:exportAddressAdditionResponse xmlns:tns="http://dom.gosuslugi.ru/schema/integration/address-validation/" xmlns:base="http://dom.gosuslugi.ru/schema/integration/base/" xmlns:xsi="http://www.w3.org/2001/XMLSchema-instance" base:version="10.0.1.2" xsi:schemaLocation="http://dom.gosuslugi.ru/schema/integration/address-validation/ ../../hcs-address-validation-types.xsd">
	<tns:AggregatedRequest>
		<tns:RequestGUID>6196c7dd-cfbb-4ca5-900f-e536c9c49282</tns:RequestGUID>
		<tns:UpdateDate>2016-08-31T09:30:47Z</tns:UpdateDate>
		<tns:IsWithdraw>false</tns:IsWithdraw>
		<tns:HouseobjSubrequest>
			<tns:SubRequestGUID>330551e0-0a6b-40bb-924f-a3ab96704304</tns:SubRequestGUID>
			<tns:Number>1</tns:Number>
			<tns:HOUSENUM>2А/3</tns:HOUSENUM>
			<tns:BUILDNUM>1</tns:BUILDNUM>
			<tns:STRUCNUM>4</tns:STRUCNUM>
			<tns:ESTSTATUS>2</tns:ESTSTATUS>
			<tns:STRSTATUS>1</tns:STRSTATUS>
			<tns:HouseState>2</tns:HouseState>
			<tns:OKTMO>
				<base:code>45941000</base:code>
				<base:name>Внутригородское муниципальное образование в городе Москве поселение Внуковское</base:name>
			</tns:OKTMO>
			<tns:AOGUID>e128507f-5307-4fd6-9171-b4183e59a9dc</tns:AOGUID>
		</tns:HouseobjSubrequest>
		<tns:Addrobj>
			<tns:AOLevel>7</tns:AOLevel>
			<tns:FormalName>Железнодорожная улица</tns:FormalName>
			<tns:ShortName>ул</tns:ShortName>
			<tns:OKTMO>
				<base:code>45941000</base:code>
				<base:name>Внутригородское муниципальное образование в городе Москве поселение Внуковское</base:name>
			</tns:OKTMO>
			<tns:AOGUID>e128507f-5307-4fd6-9171-b4183e59a9dc</tns:AOGUID>
			<tns:ParentGUID>839e2416-fdbe-4ae5-ba07-60fc7944f8fb</tns:ParentGUID>
		</tns:Addrobj>
		<tns:Addrobj>
			<tns:AOLevel>6</tns:AOLevel>
			<tns:FormalName>Станции Внуково поселок</tns:FormalName>
			<tns:ShortName>п/о</tns:ShortName>
			<tns:OKTMO>
				<base:code>45941000</base:code>
				<base:name>Внутригородское муниципальное образование в городе Москве поселение Внуковское</base:name>
			</tns:OKTMO>
			<tns:AOGUID>839e2416-fdbe-4ae5-ba07-60fc7944f8fb</tns:AOGUID>
			<tns:ParentGUID>cd7354a5-8a12-4b4d-af37-5358bde1c8e2</tns:ParentGUID>
		</tns:Addrobj>
		<tns:Addrobj>
			<tns:AOLevel>3</tns:AOLevel>
			<tns:FormalName>Внуковское поселение</tns:FormalName>
			<tns:ShortName>п</tns:ShortName>
			<tns:OKTMO>
				<base:code>45941000</base:code>
				<base:name>Внутригородское муниципальное образование в городе Москве поселение Внуковское</base:name>
			</tns:OKTMO>
			<tns:AOGUID>cd7354a5-8a12-4b4d-af37-5358bde1c8e2</tns:AOGUID>
			<tns:ParentGUID>0c5b2444-70a0-4932-980c-b4dc0d3f02b5</tns:ParentGUID>
		</tns:Addrobj>
		<tns:Addrobj>
			<tns:AOLevel>1</tns:AOLevel>
			<tns:FormalName>Москва город</tns:FormalName>
			<tns:ShortName>г</tns:ShortName>
			<tns:AOGUID>0c5b2444-70a0-4932-980c-b4dc0d3f02b5</tns:AOGUID>
		</tns:Addrobj>
	</tns:AggregatedRequest>
</tns:exportAddressAdditionResponse>
