<?xml version="1.0" encoding="UTF-8"?>
<tns:exportAddressAdditionResponse xmlns:tns="http://dom.gosuslugi.ru/schema/integration/address-validation/" xmlns:base="http://dom.gosuslugi.ru/schema/integration/base/" xmlns:xsi="http://www.w3.org/2001/XMLSchema-instance" xsi:schemaLocation="http://dom.gosuslugi.ru/schema/integration/address-validation/ ../../hcs-address-validation-types.xsd" base:version="10.0.1.2">
	<tns:AggregatedRequest>
		<tns:RequestGUID>fef23bb3-96fa-421b-993f-b9038c2f366b</tns:RequestGUID>
		<tns:UpdateDate>2016-08-31T09:30:47Z</tns:UpdateDate>
		<tns:IsWithdraw>false</tns:IsWithdraw>
		<tns:HouseobjSubrequest>
			<tns:SubRequestGUID>d7bde3dc-0b7f-4142-a6fe-cd8a6de08011</tns:SubRequestGUID>
			<tns:Number>1</tns:Number>
			<tns:HOUSENUM>11/7</tns:HOUSENUM>
			<tns:BUILDNUM>А</tns:BUILDNUM>
			<tns:STRUCNUM>1</tns:STRUCNUM>
			<tns:ESTSTATUS>2</tns:ESTSTATUS>
			<tns:STRSTATUS>1</tns:STRSTATUS>
			<tns:HouseState>2</tns:HouseState>
			<tns:OKTMO>
				<base:code>46734000</base:code>
				<base:name>Город Королев</base:name>
			</tns:OKTMO>
			<tns:AOGUID>644b1925-c8c5-4f29-9050-4f06a464c134</tns:AOGUID>
		</tns:HouseobjSubrequest>
		<tns:Addrobj>
			<tns:AOLevel>7</tns:AOLevel>
			<tns:FormalName>Береговая улица</tns:FormalName>
			<tns:ShortName>ул</tns:ShortName>
			<tns:OKTMO>
				<base:code>46734000</base:code>
				<base:name>Город Королев</base:name>
			</tns:OKTMO>
			<tns:AOGUID>644b1925-c8c5-4f29-9050-4f06a464c134</tns:AOGUID>
			<tns:ParentGUID>612d340f-edf3-4a17-a9f1-4bc52c36921d</tns:ParentGUID>
		</tns:Addrobj>
		<tns:Addrobj>
			<tns:AOLevel>6</tns:AOLevel>
			<tns:FormalName>Болшево микрорайон</tns:FormalName>
			<tns:ShortName>мкр</tns:ShortName>
			<tns:OKTMO>
				<base:code>46734000</base:code>
				<base:name>Город Королев</base:name>
			</tns:OKTMO>
			<tns:AOGUID>612d340f-edf3-4a17-a9f1-4bc52c36921d</tns:AOGUID>
			<tns:ParentGUID>819d6910-b4d1-474f-ad10-c1fa944dfca4</tns:ParentGUID>
		</tns:Addrobj>
		<tns:Addrobj>
			<tns:AOLevel>4</tns:AOLevel>
			<tns:FormalName>Королев город</tns:FormalName>
			<tns:ShortName>г</tns:ShortName>
			<tns:OKTMO>
				<base:code>46734000</base:code>
				<base:name>Город Королев</base:name>
			</tns:OKTMO>
			<tns:AOGUID>819d6910-b4d1-474f-ad10-c1fa944dfca4</tns:AOGUID>
			<tns:ParentGUID>29251dcf-00a1-4e34-98d4-5c47484a36d4</tns:ParentGUID>
		</tns:Addrobj>
		<tns:Addrobj>
			<tns:AOLevel>1</tns:AOLevel>
			<tns:FormalName>Московская область</tns:FormalName>
			<tns:ShortName>обл</tns:ShortName>
			<tns:AOGUID>29251dcf-00a1-4e34-98d4-5c47484a36d4</tns:AOGUID>
		</tns:Addrobj>
	</tns:AggregatedRequest>
</tns:exportAddressAdditionResponse>
