<?xml version="1.0" encoding="UTF-8"?>
<tns:exportAddressAdditionResponse xmlns:tns="http://dom.gosuslugi.ru/schema/integration/address-validation/" xmlns:base="http://dom.gosuslugi.ru/schema/integration/base/" xmlns:xsi="http://www.w3.org/2001/XMLSchema-instance" xsi:schemaLocation="http://dom.gosuslugi.ru/schema/integration/address-validation/ ../../hcs-address-validation-types.xsd" base:version="10.0.1.2">
	<tns:AggregatedRequest>
		<tns:RequestGUID>2edb7a42-ed51-4bb1-911b-57e945dbce35</tns:RequestGUID>
		<tns:UpdateDate>2016-08-31T09:30:47Z</tns:UpdateDate>
		<tns:IsWithdraw>false</tns:IsWithdraw>
		<tns:HouseobjSubrequest>
			<tns:SubRequestGUID>d850f11f-2138-4f09-8516-a58ae8ded575</tns:SubRequestGUID>
			<tns:Number>3</tns:Number>
			<tns:HOUSENUM>18/7</tns:HOUSENUM>
			<tns:BUILDNUM>4</tns:BUILDNUM>
			<tns:STRUCNUM>А</tns:STRUCNUM>
			<tns:ESTSTATUS>2</tns:ESTSTATUS>
			<tns:STRSTATUS>1</tns:STRSTATUS>
			<tns:HouseState>2</tns:HouseState>
			<tns:OKTMO>
				<base:code>46605101001</base:code>
				<base:name>город Волоколамск</base:name>
			</tns:OKTMO>
			<tns:AOGUID>ca8fb626-709c-4851-a8d6-cbfd592c3bf8</tns:AOGUID>
		</tns:HouseobjSubrequest>
		<tns:AddrobjSubrequest>
			<tns:AOLevel>7</tns:AOLevel>
			<tns:FormalName>Элеваторов улица</tns:FormalName>
			<tns:ShortName>ул</tns:ShortName>
			<tns:OKTMO>
				<base:code>46605101001</base:code>
				<base:name>город Волоколамск</base:name>
			</tns:OKTMO>
			<tns:SubRequestGUID>66e0af52-ac28-4b40-9a67-73f817283122</tns:SubRequestGUID>
			<tns:Number>2</tns:Number>
			<tns:ParentSubRequestGUID>262228bd-559d-40a1-b3a8-5f0223e840fd</tns:ParentSubRequestGUID>
		</tns:AddrobjSubrequest>
		<tns:AddrobjSubrequest>
			<tns:AOLevel>6</tns:AOLevel>
			<tns:FormalName>Новый микрорайон</tns:FormalName>
			<tns:ShortName>мкр</tns:ShortName>
			<tns:OKTMO>
				<base:code>46605101001</base:code>
				<base:name>город Волоколамск</base:name>
			</tns:OKTMO>
			<tns:SubRequestGUID>262228bd-559d-40a1-b3a8-5f0223e840fd</tns:SubRequestGUID>
			<tns:Number>1</tns:Number>
			<tns:ParentGUID>ca8fb626-709c-4851-a8d6-cbfd592c3bf8</tns:ParentGUID>
		</tns:AddrobjSubrequest>
		<tns:Addrobj>
			<tns:AOLevel>4</tns:AOLevel>
			<tns:FormalName>Волоколамск город</tns:FormalName>
			<tns:ShortName>г</tns:ShortName>
			<tns:OKTMO>
				<base:code>46605101001</base:code>
				<base:name>город Волоколамск</base:name>
			</tns:OKTMO>
			<tns:AOGUID>ca8fb626-709c-4851-a8d6-cbfd592c3bf8</tns:AOGUID>
			<tns:ParentGUID>ebceede7-cea0-48c8-b3ba-97b599feb687</tns:ParentGUID>
		</tns:Addrobj>
		<tns:Addrobj>
			<tns:AOLevel>3</tns:AOLevel>
			<tns:FormalName>Волоколамский район</tns:FormalName>
			<tns:ShortName>р-н</tns:ShortName>
			<tns:OKTMO>
				<base:code>46605000</base:code>
				<base:name>Волоколамский район</base:name>
			</tns:OKTMO>
			<tns:AOGUID>ebceede7-cea0-48c8-b3ba-97b599feb687</tns:AOGUID>
			<tns:ParentGUID>29251dcf-00a1-4e34-98d4-5c47484a36d4</tns:ParentGUID>
		</tns:Addrobj>
		<tns:Addrobj>
			<tns:AOLevel>1</tns:AOLevel>
			<tns:FormalName>Московская область</tns:FormalName>
			<tns:ShortName>обл</tns:ShortName>
			<tns:AOGUID>29251dcf-00a1-4e34-98d4-5c47484a36d4</tns:AOGUID>
		</tns:Addrobj>
	</tns:AggregatedRequest>
</tns:exportAddressAdditionResponse>
